mybibtex_key,Author(s),Title,Outlet,DOI,Cluster,Year of publication,size,closeness_centrality,degree_centrality
arbib_comparative_2018,arbib ma;aboitiz f;burkart m;coude g;hecht e;lieba m;pustejovsky j;putt f;russon ae;schoenemann u;semendeferi k;sinha c;stout d;volterra v;wacewicz s;wilson b,the comparative neuroprimatology 2018 (cnp-2018) road map for research on how the brain got language,interaction studies,10.1075/is.18013.arb,4,2018,1,0.355639704923336,0.019559902200488997
lycett_david_2018,lycett sj;shennan sj,david clarke's analytical archaeology at 50,world archaeology,10.1080/00438243.2018.1470561,3,2018,22,0.7483857385859664,0.7359413202933985
miller-atkins_time-averaging_2018,miller-atkins g;premo ls,time-averaging and the spatial scale of regional cultural differentiation in archaeological assemblages,science and technology of archaeological research,10.1080/20548923.2018.1504490,4,2018,15,0.6146529849022178,0.6699266503667481
peregrine_social_2018,peregrine pn,social resilience to climate-related disasters in ancient societies: a test of two hypotheses,weather climate and society,10.1175/wcas-d-17-0052.1,2,2018,9,0.7232870751342303,0.1882640586797066
psomiadis_speleothem_2018,psomiadis d;dotsika e;albanakis k;ghaleb c,speleothem record of climatic changes in the northern aegean region (greece) from the bronze age to the collapse of the roman empire,palaeogeography palaeoclimatology palaeoecology,10.1016/j.palaeo.2017.10.021,2,2018,64,0.5392537729946658,0.10513447432762836
purzycki_evolution_2018,purzycki bg;henrich j;apicella qd;baimel a;cohen e;mcnamara ra;willard ak;xygalatas d;norenzayan a,the evolution of religion and morality: a synthesis of ethnographic and experimental evidence from eight societies,religion brain \& behavior,10.1080/2153599x.2016.1267027,1,2018,96,0.7728935081814513,0.17114914425427874
riede_role_2018,riede f;johannsen nn;hogberg a;nowell a;lombard m,the role of play objects and object play in human cognitive evolution and innovation,evolutionary anthropology,10.1002/evan.21555,3,2018,37,0.7708530009608047,0.4669926650366748
singh_cultural_2018,singh m,the cultural evolution of shamanism,behavioral and brain sciences,10.1017/s0140525x17001893,NA,NA,NA,NA,NA
sterelny_religion_2018,sterelny k,religion re-explained,religion brain \& behavior,10.1080/2153599x.2017.1323779,4,2018,13,0.74220887800545,0.4400977995110024
suchowska-ducke_new_2018,suchowska-ducke p,new technologies and transformations in the european bronze age: the case of naue ii swords,bulgarsko e-spisanie za arkheologiya-bulgarian e-journal of archaeology,NA,5,2018,53,0.40994782317765177,0.034229828850855744
eerkens_evolution_2017,eerkens jw;de voogt a,the evolution of cubic dice: from the roman through post-medieval period in the netherlands,acta archaeologica,10.1111/j.1600-0390.2017.12182.x,6,2017,7,0.3725513083404146,0.007334963325183374
lee_late-occurring_2017,lee hw,late-occurring handaxes in korea: their homogeneity and variability,archaeologies-journal of the world archaeological congress,10.1007/s11759-017-9326-6,4,2017,28,0.7595698657933718,0.24205378973105135
lycett_cultural_2017,lycett sj,cultural patterns within and outside of the post-contact great plains as revealed by parfleche characteristics: implications for areal arrangements in artifactual data,journal of anthropological archaeology,10.1016/j.jaa.2017.07.003,3,2017,14,0.7814558034188631,0.3594132029339853
tremayne_mid_2017,tremayne ah;brown wa,"mid to late holocene population trends, culture change and marine resource intensification in western alaska",arctic,10.14430/arctic4681,2,2017,7,0.8329090079571736,0.5672371638141809
edinborough_radiocarbon_2017,edinborough k;porcic m;martindale a;brown tj;supernant k;ames km,radiocarbon test for demographic events in written and oral history,proceedings of the national academy of sciences of the united states of america,10.1073/pnas.1713012114,2,2017,2,0.6290059305464849,0.17114914425427874
li_human_2017,li h;liu f;cui y;ren l;storozum mj;qin z;wang j;dong g,"human settlement and its influencing factors during the historical period in an oasis-desert transition zone of dunhuang, hexi corridor, northwest china",quaternary international,10.1016/j.quaint.2016.11.044,2,2017,77,0.6080375847662389,0.12469437652811736
lewens_human_2017,lewens t,"human nature, human culture: the case of cultural evolution",interface focus,10.1098/rsfs.2017.0018,1,2017,78,0.640841443957287,0.6356968215158925
bebber_tempered_2017,bebber mr,tempered strength: a controlled experiment assessing opportunity costs of adding temper to clay,journal of archaeological science,10.1016/j.jas.2017.08.002,3,2017,1,0.741605102485223,0.5134474327628362
sedova_methodological_2017,sedova t,methodological relevance of the concept of culture,filozofia,NA,NA,NA,NA,NA,NA
tennie_early_2017,tennie c;premo ls;braun dr;mcpherron sp,early stone tools and cultural transmission: resetting the null hypothesis,current anthropology,10.1086/693846,NA,NA,NA,NA,NA
bisin_evolution_2017,bisin a,"the evolution of value systems: a review essay on ian morris's foragers, farmers, and fossil fuels",journal of economic literature,10.1257/jel.20151352,1,2017,10,0.5580776128266357,0.5012224938875306
dibble_major_2017,dibble hl;holdaway sj;lin sc;braun dr;douglass mj;iovita r;mcpherron sp;olszewski di;sandgathe d,major fallacies surrounding stone artifacts and assemblages,journal of archaeological method and theory,10.1007/s10816-016-9297-8,4,2017,31,0.9261668588879899,0.4841075794621027
marks_what_2017,marks j,what if the human mind evolved for nonrational thought? an anthropological perspective,zygon,10.1111/zygo.12350,1,2017,94,0.6437215647830858,0.20537897310513448
watkins_pleistocene_2017,watkins t,from pleistocene to holocene: the prehistory of southwest asia in evolutionary context,history and philosophy of the life sciences,10.1007/s40656-017-0152-3,4,2017,7,0.7337986554434881,0.43765281173594134
allcock_long-term_2017,allcock sl,"long-term socio-environmental dynamics and adaptive cycles in cappadocia, turkey during the holocene",quaternary international,10.1016/j.quaint.2017.06.065,2,2017,1,0.6795829867793565,0.1100244498777506
peters_resilience_2017,peters r;zimmermann a,resilience and cyclicity: towards a macrohistory of the central european neolithic,quaternary international,10.1016/j.quaint.2017.03.073,5,2017,41,0.6830970351849431,0.5281173594132029
bar-yosef_can_2017,bar-yosef o,can archaeology tell us about the evolution of cognition and language?,journal of neurolinguistics,10.1016/j.jneuroling.2016.11.009,4,2017,1,0.6818048212846317,0.30317848410757947
smith_stern_2017,smith jd,"``stern champion of the human race, of man as human'': alexander f. chamberlain and reform in the age of imperialism and jim crow",journal of american studies,10.1017/s0021875816001274,3,2017,129,0.5748730311458827,0.014669926650366748
toffolo_10400-year-old_2017,toffolo mb;ullman m;caracuta s;boaretto e,"a 10,400-year-old sunken lime kiln from the early pre-pottery neolithic b at the nesher-ramla quarry (el-khirbe), israel",journal of archaeological science-reports,10.1016/j.jasrep.2017.06.014,2,2017,30,0.5144076992952696,0.097799511002445
derrico_identifying_2017,d'errico f;banks we;warren dl;sgubin g;van niekerk k;henshilwood c;daniau al;goni mfs,identifying early modern human ecological niche expansions and associated cultural dynamics in the south african middle stone age,proceedings of the national academy of sciences of the united states of america,10.1073/pnas.1620752114,4,2017,12,0.6970318543885848,0.28361858190709044
stout_evolutionary_2017,stout d;hecht ee,evolutionary neuroscience of cumulative culture,proceedings of the national academy of sciences of the united states of america,10.1073/pnas.1620738114,4,2017,2,0.7417325270101947,0.39119804400978
bai_yijun_5400_2017,bai yijun by;zhang pingzhong zpz;gao tao gt;yu renzhe yrz;zhou;pengchao zpc;cheng hai ch,the 5400 a bp extreme weakening event of the asian summer monsoon and cultural evolution,science china-earth sciences,10.1007/s11430-016-9017-3,2,2017,1,0.6272911142143502,0.1198044009779951
buskell_what_2017,buskell a,what are cultural attractors?,biology \& philosophy,10.1007/s10539-017-9570-6,1,2017,1,0.6432355063787363,0.6577017114914425
chen_early_2017,chen s;yu pl,early ``neolithics'' of china: variation and evolutionary implications,journal of anthropological research,NA,2,2017,6,0.6467320055700042,0.16625916870415647
schillinger_differences_2017,schillinger k;mesoudi a;lycett sj,differences in manufacturing traditions and assemblage-level patterns: the origins of cultural differences in archaeological data,journal of archaeological method and theory,10.1007/s10816-016-9280-4,3,2017,110,0.693260924055677,0.6919315403422983
werner_middle_2017,werner jj;willoughby pr,"middle stone age technology and cultural evolution at magubike rockshelter, southern tanzania",african archaeological review,10.1007/s10437-017-9254-2,4,2017,9,0.6722314056844094,0.4132029339853301
creanza_greater_2017,creanza n;kolodny o;feldman mw,greater than the sum of its parts? modelling population contact and interaction of cultural repertoires,journal of the royal society interface,10.1098/rsif.2017.0171,4,2017,2,0.7813171114282087,0.7432762836185819
raffield_male-biased_2017,raffield b;price n;collard m,male-biased operational sex ratios and the viking phenomenon: an evolutionary anthropological perspective on late iron age scandinavian raiding,evolution and human behavior,10.1016/j.evolhumbehav.2016.10.013,6,2017,35,0.39072130304276526,0.012224938875305624
oconnor_fishhook_2017,o'connor jt;white fj;hunt tl,fishhook variability and cultural transmission in east polynesia,archaeology in oceania,10.1002/arco.5120,3,2017,2,0.6657213454571321,0.6063569682151589
discamps_reconstructing_2017,discamps e;royer a,reconstructing palaeoenvironmental conditions faced by mousterian hunters during mis 5 to 3 in southwestern france: a multi-scale approach using data from large and small mammal communities,quaternary international,10.1016/j.quaint.2016.02.067,4,2017,27,0.7675905841429409,0.09290953545232274
buchanan_environment-induced_2017,buchanan b;chao a;chiu ch;colwell rk;o'brien mj;werner a;eren mi,environment-induced changes in selective constraints on social learning during the peopling of the americas,scientific reports,10.1038/srep44431,3,2017,1,0.654078263199697,0.4180929095354523
clarke_swashbuckling_2017,clarke e;heyes c,the swashbuckling anthropologist: henrich on the secret of our success,biology \& philosophy,10.1007/s10539-016-9554-y,1,2017,3,0.5767588082899563,0.2885085574572127
last_big_2017,last c,"big historical foundations for deep future speculations: cosmic evolution, atechnogenesis, and technocultural civilization",foundations of science,10.1007/s10699-015-9434-y,1,2017,10,0.881712333641589,0.28361858190709044
amick_evolving_2017,amick ds,evolving views on the pleistocene colonization of north america,quaternary international,10.1016/j.quaint.2015.12.030,3,2017,1,0.9073638582888877,0.7603911980440098
suarez_human_2017,suarez r,"the human colonization of the southeast plains of south america: climatic conditions, technological innovations and the peopling of uruguay and south of brazil",quaternary international,10.1016/j.quaint.2016.02.018,4,2017,236,0.6702446749400283,0.12224938875305623
purzycki_anthrotools_2017,purzycki bg;jamieson-lane a,anthrotools: an r package for cross-cultural ethnographic data analysis,cross-cultural research,10.1177/1069397116680352,1,2017,7,0.5846283503125942,0.029339853300733496
yang_copper_2017,yang y;dong g;zhang s;cui y;li h;chen g;dodson j;chen f,"copper content in anthropogenic sediments as a tracer for detecting smelting activities and its impact on environment during prehistoric period in hexi corridor, northwest china",holocene,10.1177/0959683616658531,2,2017,59,0.6535072375154026,0.097799511002445
isern_modeling_2017,isern n;zilhao j;fort j;ammerman aj,modeling the role of voyaging in the coastal spread of the early neolithic in the west mediterranean,proceedings of the national academy of sciences of the united states of america,10.1073/pnas.1613413114,2,2017,23,0.6029788921174521,0.3056234718826406
bendixen_peering_2017,bendixen t;purzycki bg,peering into the minds of gods: what cross-cultural variation in gods' concerns can tell us about the evolution of religion,journal for the cognitive science of religion,10.1558/jcsr.40951,1,2017,2,0.844002016241703,0.5256723716381418
clarkson_teaching_2017,clarkson c,teaching complex flint knapping strategies in the classroom using ``potato knapping'',lithic technology,10.1080/01977261.2017.1385213,4,2017,1,0.5211050952164378,0.18337408312958436
dotte-sarout_how_2017,dotte-sarout e,how dare our `prehistoric' have a prehistory of their own?! the interplay of historical and biographical contexts in early french archaeology of the pacific,journal of pacific archaeology,NA,5,2017,4,0.46572239134079296,0.009779951100244499
hays_theological_2017,hays c;burdett m,a theological cartography of cultural evolution,theology and science,10.1080/14746700.2017.1369760,1,2017,14,0.5790345975702207,0.23471882640586797
homsher_amorite_2017,homsher rs;cradic ms,the amorite problem: resolving an historical dilemma,levant,10.1080/00758914.2017.1418038,2,2017,11,0.9018097248560264,0.2273838630806846
livni_testing_2017,livni j,testing competing archaeological theories of israel's origins using computation techniques,archeologia e calcolatori,NA,4,2017,39,0.6560222589146887,0.44254278728606355
pardo-gordo_complex_2017,pardo-gordo s,complex adaptative systems and computational simulation in archaeology,trabajos de prehistoria,10.3989/tp.2017.12181,5,2017,16,0.831509863696522,0.6185819070904646
tamura_quantifying_2017,tamura k;ihara y,quantifying cultural macro-evolution: a case study of the hinoeuma fertility drop,evolution and human behavior,10.1016/j.evolhumbehav.2016.07.007,4,2017,14,0.6185130771998143,0.6552567237163814
yablokov_biosphere_2017,yablokov a;levchenko v;kerzhentsev a,the biosphere as a living system. on the harmonization of human and biosphere relationship,philosophy and cosmology-filosofiya i kosmologiya,NA,2,2017,45,0.4716509968272899,0.02444987775061125
crema_revealing_2016,crema er;kandler a;shennan s,revealing patterns of cultural transmission from frequency data: equilibrium and non-equilibrium assumptions,scientific reports,10.1038/srep39122,3,2016,6,0.6165110049864141,0.5427872860635696
de_voogt_navigating_2016,de voogt a,"navigating disciplinary boundaries: script, games and the role of language",evolutionary biology,10.1007/s11692-015-9316-9,3,2016,8,0.6549789062439576,0.7041564792176039
kressing_lateral_2016,kressing f,"lateral and vertical transfer in biology, linguistics and anthropology: an account of widely neglected ideas in the formation of evolutionary theories",evolutionary biology,10.1007/s11692-015-9330-y,1,2016,11,0.7416830648145539,0.38141809290953543
taylor_first_2016,taylor r,the first stone and the last tasmanian: the colonial correspondence of edward burnett tylor and henry ling roth,oceania,10.1002/ocea.5145,1,2016,41,0.6152813700405108,0.06845965770171149
damlien_eastern_2016,damlien h,eastern pioneers in westernmost territories? current perspectives on mesolithic hunter-gatherer large-scale interaction and migration within northern eurasia,quaternary international,10.1016/j.quaint.2014.02.023,3,2016,1,0.702408813085832,0.6479217603911981
grove_population_2016,grove m,"population density, mobility, and cultural transmission",journal of archaeological science,10.1016/j.jas.2016.09.002,4,2016,10,0.5934957297897763,0.3740831295843521
hosner_spatiotemporal_2016,hosner d;wagner m;tarasov pe;chen x;leipe c,spatiotemporal distribution patterns of archaeological sites in china during the neolithic and bronze age: an overview,holocene,10.1177/0959683616641743,2,2016,8,0.6859278313971922,0.18092909535452323
premo_effective_2016,premo ls,effective population size and the effects of demography on cultural diversity and technological complexity,american antiquity,10.7183/0002-7316.81.4.605,4,2016,36,0.632865695953556,0.7090464547677262
buchanan_drivers_2016,buchanan b;o'brien mj;collard m,drivers of technological richness in prehistoric texas: an archaeological test of the population size and environmental risk hypotheses,archaeological and anthropological sciences,10.1007/s12520-015-0245-4,4,2016,1,0.680345159679032,0.6650366748166259
little_how_2016,little cajl;lancy df,how do children become workers? making sense of conflicting accounts of cultural transmission in anthropology and psychology,ethos,10.1111/etho.12131,1,2016,16,0.7142887749686924,0.1295843520782396
premo_cultural_2016,premo ls;tostevin gb,cultural transmission on the taskscape: exploring the effects of taskscape visibility on cultural diversity,plos one,10.1371/journal.pone.0161766,4,2016,36,0.683415625314257,0.7603911980440098
rohling_of_2016,rohling ej,of lakes and fields: a framework for reconciling palaeoclimatic drought inferences with archaeological impacts,journal of archaeological science,10.1016/j.jas.2016.07.005,2,2016,33,0.5825302592845616,0.097799511002445
zhang_dongju_history_2016,zhang dongju zdj;dong guanghui dgh;wang hui wh;ren xiaoyan rxy;ha;pipu'u hpp;qiang mingrui qmr;chen fahu cfh,history and possible mechanisms of prehistoric human migration to the tibetan plateau,science china-earth sciences,10.1007/s11430-015-5482-x,2,2016,57,0.7469661150892554,0.1271393643031785
lycett_factors_2016,lycett sj;schillinger k;eren mi;von;cramon-taubadel n;mesoudi a,"factors affecting acheulean handaxe variation: experimental insights, microevolutionary processes, and macroevolutionary outcomes",quaternary international,10.1016/j.quaint.2015.08.021,3,2016,30,0.7491379224313679,0.7677261613691931
guo_palaeo-earthquake_2016,guo y;huang cc;pang j;zha x;zhou y;zhou q;hu g,"palaeo-earthquake and palaeo-mudflow events at the machangyuan ruins in the huangshui river valley, northeastern margin of the tibetan plateau",holocene,10.1177/0959683616638437,2,2016,6,0.5910050847267345,0.08557457212713937
scanlon_study_2016,scanlon la,study of knots in material culture,journal of knot theory and its ramifications,10.1142/s0218216516410157,1,2016,45,0.5005339283341714,0.4034229828850856
collard_empirical_2016,collard m;vaesen k;cosgrove r;roebroeks w,the empirical case against the `demographic turn' in palaeolithic archaeology,philosophical transactions of the royal society b-biological sciences,10.1098/rstb.2015.0242,4,2016,4,0.6214230905938488,0.4621026894865526
marean_transition_2016,marean cw,the transition to foraging for dense and predictable resources and its impact on the evolution of modern humans,philosophical transactions of the royal society b-biological sciences,10.1098/rstb.2015.0239,4,2016,193,0.8570215274408508,0.5281173594132029
arnold_entrenched_2016,arnold je;sunell s;nigra bt;bishop kj;jones t;bongers j,entrenched disbelief: complex hunter-gatherers and the case for inclusive cultural evolutionary thinking,journal of archaeological method and theory,10.1007/s10816-015-9246-y,5,2016,1,0.8622961034592521,0.36674816625916873
mann_have_2016,mann m,have human societies evolved? evidence from history and pre-history,theory and society,10.1007/s11186-016-9269-8,5,2016,8,0.5947658796198488,0.15158924205378974
montes_landscape_2016,montes l;domingo r;gonzalez-samperiz m;aranbarri j;castanos lm;alcolea m;laborda r,"landscape, resources and people during the mesolithic and neolithic times in ne iberia: the arba de biel basin",quaternary international,10.1016/j.quaint.2015.05.041,2,2016,77,0.5019212726815692,0.1393643031784841
obrien_design_2016,o'brien mj;boulanger mt;buchanan ra;lyman rl;lipo cp;madsen me;eren mi,design space and cultural transmission: case studies from paleoindian eastern north america,journal of archaeological method and theory,10.1007/s10816-015-9258-7,3,2016,5,0.8476518741088658,0.823960880195599
schillinger_copying_2016,schillinger k;mesoudi a;lycett sj,"copying error, evolution, and phylogenetic signal in artifactual traditions: an experimental approach using ``model artifacts''",journal of archaeological science,10.1016/j.jas.2016.04.013,3,2016,87,0.7176398853147526,0.5647921760391198
yi_rethinking_2016,yi m;gao x;li f;chen f,rethinking the origin of microblade technology: a chronological and ecological perspective,quaternary international,10.1016/j.quaint.2015.07.009,4,2016,81,0.7064372653978288,0.2078239608801956
morin_reasons_2016,morin o,reasons to be fussy about cultural evolution,biology \& philosophy,10.1007/s10539-016-9516-4,1,2016,2,0.6323544144680301,0.530562347188264
pustovoytov_early_2016,pustovoytov k;riehl s,the early bronze age/middle bronze age transition and the aquifer geography in the near east,journal of archaeological science,10.1016/j.jas.2016.02.005,2,2016,11,0.43339824511539643,0.08068459657701711
vaesen_population_2016,vaesen k;collard m;cosgrove r;roebroeks w,population size does not explain past changes in cultural complexity,proceedings of the national academy of sciences of the united states of america,10.1073/pnas.1520288113,4,2016,83,0.7507067450255799,0.5647921760391198
clarke_climatic_2016,clarke j;brooks n;banning eb;bar-matthews m;campbell s;clare l;cremaschi m;di;lernia s;drake n;gallinaro m;manning s;nicoll k;philip g;rosen s;schoop ud;tafuri ma;weninger b;zerboni a,climatic changes and social transformations in the near east and north africa during the `long' 4th millennium bc: a comparative study of environmental and archaeological evidence,quaternary science reviews,10.1016/j.quascirev.2015.10.003,2,2016,5,0.8331624549278694,0.11491442542787286
barton_cultural_2016,barton l,the cultural context of biological adaptation to high elevation tibet,archaeological research in asia,10.1016/j.ara.2016.01.001,2,2016,1,0.6878497672053744,0.13202933985330073
cegielski_rethinking_2016,cegielski wh;rogers jd,rethinking the role of agent-based modeling in archaeology,journal of anthropological archaeology,10.1016/j.jaa.2016.01.009,3,2016,2,0.8719439935087514,0.3422982885085575
french_demography_2016,french jc,demography and the palaeolithic archaeological record,journal of archaeological method and theory,10.1007/s10816-014-9237-4,4,2016,4,0.903266107540232,1
gilpin_ecocultural_2016,gilpin w;feldman mw;aoki k,an ecocultural model predicts neanderthal extinction through competition with modern humans,proceedings of the national academy of sciences of the united states of america,10.1073/pnas.1524861113,4,2016,3,0.6539932683265648,0.5036674816625917
angel_vertex_2016,angel d;amutha a,vertex covering and strong covering of flower like network structures,fourth international conference on recent trends in computer science \& engineering (icrtcse 2016),10.1016/j.procs.2016.05.143,NA,NA,NA,NA,NA
capocasa_between_2016,capocasa m;mccuen v;venier b;rufo f,between universal and local: towards an evolutionary anthropology of emotions,anthropological notebooks,NA,1,2016,6,0.6651994187701031,0.41075794621026895
da_silva_comparative_2016,da silva sg;tehrani jj,comparative phylogenetic analyses uncover the ancient roots of indo-european folktales,royal society open science,10.1098/rsos.150645,1,2016,1,0.6066120497741824,0.2787286063569682
lycett_levallois_2016,lycett sj;von cramon-taubadel n;eren mi,levallois: potential implications for learning and cultural transmission capacities,lithic technology,10.1179/2051618515y.0000000012,4,2016,3,0.7655828889476941,0.3374083129584352
mackay_technological_2016,mackay a,technological change and the importance of variability: the western cape of south africa from mis 6-2,africa from mis 6-2: population dynamics and paleoenvironments,10.1007/978-94-017-7520-5\_3,4,2016,8,0.7783114720327605,0.78239608801956
stewart_africa_2016,stewart ba;jones sc,africa from mis 6-2: the florescence of modern humans,africa from mis 6-2: population dynamics and paleoenvironments,10.1007/978-94-017-7520-5\_1,4,2016,262,0.7841648100873958,0.3154034229828851
tennie_island_2016,tennie c;braun dr;premo ls;mcpherron sp,the island test for cumulative culture in the paleolithic,nature of culture,10.1007/978-94-017-7426-0\_11,4,2016,22,0.8028750505899187,0.7212713936430318
kolodny_evolution_2015,kolodny o;creanza n;feldman mw,evolution in leaps: the punctuated accumulation and loss of cultural innovations,proceedings of the national academy of sciences of the united states of america,10.1073/pnas.1520492112,4,2015,4,0.7340780749943333,0.726161369193154
henrich_big_2015,henrich j;chudek m;boyd r,the big man mechanism: how prestige fosters cooperation and creates prosocial leaders,philosophical transactions of the royal society b-biological sciences,10.1098/rstb.2015.0013,1,2015,14,0.7871768966588361,0.6063569682151589
de_voogt_production_2015,de voogt a;eerkens jw;sherman-presser r,production bias in cultural evolution: an examination of cubic dice variation in experimental and archaeological contexts,journal of anthropological archaeology,10.1016/j.jaa.2015.07.003,3,2015,10,0.6081138243761819,0.6185819070904646
fogarty_cultural_2015,fogarty l;creanza n;feldman mw,cultural evolutionary perspectives on creativity and human innovation,trends in ecology \& evolution,10.1016/j.tree.2015.10.004,4,2015,2,0.7066042335877832,0.6723716381418093
porcic_exploring_2015,porcic m,"exploring the effects of assemblage accumulation on diversity and innovation rate estimates in neutral, conformist, and anti-conformist models of cultural transmission",journal of archaeological method and theory,10.1007/s10816-014-9217-8,3,2015,11,0.7003315078372925,0.7726161369193154
