"mybibtex_key","Author(s)","Title","Outlet","DOI","Cluster","Year of publication","closeness_centrality"
"suchowska-ducke_new_2018","suchowska-ducke p","new technologies and transformations in the european bronze age: the case of naue ii swords","bulgarsko e-spisanie za arkheologiya-bulgarian e-journal of archaeology","NA",4,2018,0.513818746123964
"eerkens_evolution_2017","eerkens jw;de voogt a","the evolution of cubic dice: from the roman through post-medieval period in the netherlands","acta archaeologica","10.1111/j.1600-0390.2017.12182.x",4,2017,0.548919391817628
"bisin_evolution_2017","bisin a","the evolution of value systems: a review essay on ian morris's foragers, farmers, and fossil fuels","journal of economic literature","10.1257/jel.20151352",4,2017,0.733712338645142
"oconnor_fishhook_2017","o'connor jt;white fj;hunt tl","fishhook variability and cultural transmission in east polynesia","archaeology in oceania","10.1002/arco.5120",4,2017,0.802383034854408
"crema_revealing_2016","crema er;kandler a;shennan s","revealing patterns of cultural transmission from frequency data: equilibrium and non-equilibrium assumptions","scientific reports","10.1038/srep39122",4,2016,0.806713194194065
"de_voogt_navigating_2016","de voogt a","navigating disciplinary boundaries: script, games and the role of language","evolutionary biology","10.1007/s11692-015-9316-9",4,2016,0.882645831925241
"damlien_eastern_2016","damlien h","eastern pioneers in westernmost territories? current perspectives on mesolithic hunter-gatherer large-scale interaction and migration within northern eurasia","quaternary international","10.1016/j.quaint.2014.02.023",4,2016,0.767196455764218
"premo_cultural_2016","premo ls;tostevin gb","cultural transmission on the taskscape: exploring the effects of taskscape visibility on cultural diversity","plos one","10.1371/journal.pone.0161766",4,2016,0.907252746403924
"de_voogt_production_2015","de voogt a;eerkens jw;sherman-presser r","production bias in cultural evolution: an examination of cubic dice variation in experimental and archaeological contexts","journal of anthropological archaeology","10.1016/j.jaa.2015.07.003",4,2015,0.801043976323881
"porcic_exploring_2015","porcic m","exploring the effects of assemblage accumulation on diversity and innovation rate estimates in neutral, conformist, and anti-conformist models of cultural transmission","journal of archaeological method and theory","10.1007/s10816-014-9217-8",4,2015,0.948074008632727
"ross_frequency-dependent_2015","ross ct;joyas campino p;winterhalder b","frequency-dependent social transmission and the interethnic transfer of female genital modification in the african diaspora and indigenous populations of colombia","human nature-an interdisciplinary biosocial perspective","10.1007/s12110-015-9234-7",4,2015,0.694777836124082
"wilf_routinized_2015","wilf e","routinized business innovation: an undertheorized engine of cultural evolution","american anthropologist","10.1111/aman.12336",4,2015,0.706247232696774
"rorabaugh_modeling_2015","rorabaugh a","modeling pre-european contact coast salish seasonal social networks and their impacts on unbiased cultural transmission","jasss-the journal of artificial societies and social simulation","10.18564/jasss.2911",4,2015,0.954098945618538
"maccoun_balancing_2015","maccoun rj","balancing evidence and norms in cultural evolution","organizational behavior and human decision processes","10.1016/j.obhdp.2014.09.009",4,2015,0.872691997242786
"munson_metaphors_2015","munson j","from metaphors to practice operationalizing network concepts for archaeological stratigraphy","journal of archaeological method and theory","10.1007/s10816-013-9181-8",4,2015,0.48077312236821
"isaksson_novel_2015","isaksson s;funcke a;envall i;enquist m;lindenfors p","a novel method to analyze social transmission in chronologically sequenced assemblages, implemented on cultural inheritance of the art of cooking","plos one","10.1371/journal.pone.0122092",4,2015,0.584468039765617
"lipo_theoretically-sufficient_2015","lipo cp;madsen me;dunnell rc","a theoretically-sufficient and computationally-practical technique for deterministic frequency seriation","plos one","10.1371/journal.pone.0124942",4,2015,0.764287315463518
"rorabaugh_timing_2015","rorabaugh an;fulkerson tj","timing of the introduction of arrow technologies in the salish sea, northwest north america","lithic technology","10.1179/2051618514y.0000000009",4,2015,0.538798846200308
"crema_approximate_2014","crema er;edinborough k;kerig t;shennan sj","an approximate bayesian computation approach for inferring patterns of cultural evolutionary change","journal of archaeological science","10.1016/j.jas.2014.07.014",4,2014,0.930242604064678
"downey_all_2014","downey g","all forms of writing","mind \& language","10.1111/mila.12052",4,2014,0.612134307673123
"zvelebil_human_2013","zvelebil m;weber aw","human bioarchaeology: group identity and individual life histories - introduction","journal of anthropological archaeology","10.1016/j.jaa.2012.01.003",4,2013,0.883206555904891
"salvatori_disclosing_2012","salvatori s","disclosing archaeological complexity of the khartoum mesolithic: new data at the site and regional level","african archaeological review","10.1007/s10437-012-9119-7",4,2012,0.573128918733622
"unsworth_anthropology_2012","unsworth sj","anthropology in the cognitive sciences: the value of diversity","topics in cognitive science","10.1111/j.1756-8765.2012.01193.x",4,2012,0.801604477751266
"smith_archaeology_2012","smith me;feinman gm;drennan rd;earle t;morris i","archaeology as a social science","proceedings of the national academy of sciences of the united states of america","10.1073/pnas.1201714109",4,2012,0.453854018905974
"scholnick_spatial_2012","scholnick jb","the spatial and temporal diffusion of stylish innovations in material culture","advances in complex systems","10.1142/s0219525911003244",4,2012,0.871328490537739
"shennan_descent_2011","shennan s","descent with modification and the archaeological record","philosophical transactions of the royal society b-biological sciences","10.1098/rstb.2010.0380",4,2011,0.978667608922645
"perreault_mobility-driven_2011","perreault c;brantingham pj","mobility-driven cultural transmission along the forager-collector continuum","journal of anthropological archaeology","10.1016/j.jaa.2010.10.003",4,2011,0.967631655948537
"premo_spatial_2011","premo ls;scholnick jb","the spatial scale of social learning affects cultural diversity","american antiquity","10.7183/0002-7316.76.1.163",4,2011,0.812852312378566
"obrien_cultural_2010","o'brien mj;lyman rl;mesoudi a;vanpool tl","cultural traits as units of analysis","philosophical transactions of the royal society b-biological sciences","10.1098/rstb.2010.0012",4,2010,0.881297637838551
"brantingham_detecting_2010","brantingham pj;perreault c","detecting the effects of selection and stochastic forces in archaeological assemblages","journal of archaeological science","10.1016/j.jas.2010.07.021",4,2010,0.799719684997278
"lipo_stylistic_2010","lipo cp;hunt tl;hundtoft b","stylistic variability of stemmed obsidian tools (mata'a), frequency seriation, and the scale of social interaction on rapa nui (easter island)","journal of archaeological science","10.1016/j.jas.2010.05.015",4,2010,0.786866198334338
"charlton_explaining_2010","charlton mf;crew p;rehren t;shennan sj","explaining the evolution of ironmaking recipes - an example from northwest wales","journal of anthropological archaeology","10.1016/j.jaa.2010.05.001",4,2010,0.920692188521573
"steele_ceramic_2010","steele j;glatz c;kandler a","ceramic diversity, random copying, and tests for selectivity in ceramic production","journal of archaeological science","10.1016/j.jas.2009.12.039",4,2010,0.886360032342303
"macdonald_evolution_2010","macdonald dh","the evolution of folsom fluting","plains anthropologist","10.1179/pan.2010.011",4,2010,0.737788515352596
"lyman_metric_2009","lyman rl;vanpool tl","metric data in archaeology: a study of intra-analyst and inter-analyst variation","american antiquity","10.1017/s0002731600048721",4,2009,0.563340018606636
"steele_introduction_2009","steele j;shennan s","introduction: demography and cultural macroevolution","human biology","10.3378/027.081.0301",4,2009,0.813971643316524
"hamilton_accumulation_2009","hamilton mj;buchanan b","the accumulation of stochastic copying errors causes drift in culturally transmitted technologies: quantifying clovis evolutionary dynamics","journal of anthropological archaeology","10.1016/j.jaa.2008.10.005",4,2009,0.848236937721732
"lyman_diversity_2009","lyman rl;vanpool tl;o'brien mj","the diversity of north american projectile-point types, before and after the bow and arrow","journal of anthropological archaeology","10.1016/j.jaa.2008.12.002",4,2009,0.773435417699473
"lyman_graphing_2009","lyman rl","graphing evolutionary pattern and process: a history of techniques in archaeology and paleobiology","journal of human evolution","10.1016/j.jhevol.2008.11.001",4,2009,0.715468292841428
"lyman_variation_2008","lyman rl;vanpool tl;o'brien mj","variation in north american dart points and arrow points when one or both are present","journal of archaeological science","10.1016/j.jas.2008.05.008",4,2008,0.826423413082155
"mesoudi_cultural_2008","mesoudi a;o'brien mj","the cultural transmission of great basin projectile-point technology ii: an agent-based computer simulation","american antiquity","10.2307/25470521",4,2008,1
"gabora_cultural_2008","gabora l","the cultural evolution of socially situated cognition","cognitive systems research","10.1016/j.cogsys.2007.05.004",4,2008,0.785471670185534
"ihara_spread_2008","ihara y","spread of costly prestige-seeking behavior by social learning","theoretical population biology","10.1016/j.tpb.2007.10.002",4,2008,0.915250766482808
"marwick_beyond_2008","marwick b","beyond typologies: the reduction thesis and its implications for lithic assemblages in southeast asia","bulletin of the indo-pacific prehistory association, vol 28","NA",4,2008,0.722937039953085
"shennan_evolution_2008","shennan s","evolution in archaeology","annual review of anthropology","10.1146/annurev.anthro.37.081407.085153",4,2008,0.895292682855271
"de_block_mating_2007","de block a;dewitte s","mating games: cultural evolution and sexual selection","biology \& philosophy","10.1007/s10539-006-9041-y",4,2007,0.664562581947394
"eerkens_cultural_2007","eerkens jw;lipo cp","cultural transmission theory and the archaeological record: providing context to understanding variation and temporal changes in material culture","journal of archaeological research","10.1007/s10814-007-9013-z",4,2007,0.889636445860686
"brantingham_unified_2007","brantingham pj","a unified evolutionary model of archaeological style and function based on the price equation","american antiquity","10.2307/40035853",4,2007,0.848656167462945
"lyman_archaeologys_2007","lyman rl","archaeology's quest for a seat at the high table of anthropology","journal of anthropological archaeology","10.1016/j.jaa.2006.11.003",4,2007,0.465465538795676
"lyman_cultural_2006","lyman rl","cultural traits and cultural integration","behavioral and brain sciences","10.1017/s0140525x06349084",4,2006,0.726510695162966
"bentley_academic_2006","bentley ra","academic copying, archaeology and the english language","antiquity","10.1017/s0003598x00093364",4,2006,0.775813993205739
"eerkens_cultural_2005","eerkens jw;lipo cp","cultural transmission, copying errors, and the generation of variation in material culture and the archaeological record","journal of anthropological archaeology","10.1016/j.jaa.2005.08.001",4,2005,0.903210046868297
"chatters_darwinian_2005","chatters jc;prentiss wc","a darwinian macro-evolutionary perspective on the development of hunter-gatherer systems in northwestern north america","world archaeology","10.1080/0043824042000329568",4,2005,0.681441932889667
"obrien_evolutionism_2005","o'brien mj","evolutionism and north america's archaeological record","world archaeology","10.1080/0043824042000329559",4,2005,0.878468282278416
"lyman_history_2004","lyman rl;o'brien mj","a history of normative theory in americanist archaeology","journal of archaeological method and theory","10.1007/s10816-004-1420-6",4,2004,0.7211576471829
"bentley_random_2004","bentley ra;hahn mw;shennan sj","random drift and culture change","proceedings of the royal society b-biological sciences","10.1098/rspb.2004.2746",4,2004,0.899771696550433
"stone_biotechnology_2004","stone gd","biotechnology and the political ecology of information in india","human organization","10.17730/humo.63.2.jgvu7rlfafk9jwf9",4,2004,0.668531132049567
"kohler_vessels_2004","kohler ta;vanbuskirk s;ruscavage-barz s","vessels and villages: evidence for conformist transmission in early village aggregations on the pajarito plateau, new mexico","journal of anthropological archaeology","10.1016/j.jaa.2003.12.003",4,2004,0.812542320084481
"henrich_cultural_2004","henrich j","cultural group selection, coevolutionary processes and large-scale cooperation","journal of economic behavior \& organization","10.1016/s0167-2681(03)00094-5",4,2004,0.741034452383563
"gumerman_evolution_2003","gumerman gj;swedlund ac;dean js;epstein jm","the evolution of social behavior in the prehistoric american southwest","artificial life","10.1162/106454603322694861",4,2003,0.895348314562209
"bentley_cultural_2003","bentley ra;shennan sj","cultural transmission and stochastic network growth","american antiquity","10.2307/3557104",4,2003,0.884684305503601
"obrien_what_2003","o'brien mj;lyman rl;leonard rd","what is evolution? a response to bamforth","american antiquity","10.2307/3557109",4,2003,0.786421027025701
"lyman_cultural_2003","lyman rl;o'brien mj","cultural traits: units of analysis in early twentieth-century anthropology","journal of anthropological research","10.1086/jar.59.2.3631642",4,2003,0.654624532747816
"prentiss_cultural_2003","prentiss wc;chatters jc","cultural diversification and decimation in the prehistoric record","current anthropology","10.1086/344488",4,2003,0.797584193388191
"obrien_two_2002","o'brien mj;lyman rl;saab y;saab e;darwent ds","two issues in archaeological phylogenetics: taxon construction and outgroup selection","journal of theoretical biology","10.1006/jtbi.2002.2548",4,2002,0.680927208786251
"weiss_kulturcrisis_2002","weiss k;hayashida f","kulturcrisis! cultural evolution going round in circles","evolutionary anthropology","10.1002/evan.10029",4,2002,0.657403571260927
"obrien_cladistics_2001","o'brien mj;darwent j;lyman rl","cladistics is useful for reconstructing archaeological phylogenies: palaeoindian points from the southeastern united states","journal of archaeological science","10.1006/jasc.2001.0681",4,2001,0.69219187729465
"shennan_population_2000","shennan s","population, culture history, and the dynamics of culture change","current anthropology","10.1086/317403",4,2000,0.792900335759669
"fracchia_does_1999","fracchia j;lewontin rc","does culture evolve?","history and theory","10.1111/0018-2656.00104",4,1999,0.700738328778441
"lyman_goals_1998","lyman rl;o'brien mj","the goals of evolutionary archaeology","current anthropology","10.1086/204786",4,1998,0.762547508492133
"macdonald_subsistence_1998","macdonald dh","subsistence, sex, and cultural transmission in folsom culture","journal of anthropological archaeology","10.1006/jaar.1998.0325",4,1998,0.492409976729929
"boast_small_1997","boast r","a small company of actors - a critique of style","journal of material culture","10.1177/135918359700200202",4,1997,0.514824629393391
"neiman_stylistic_1995","neiman fd","stylistic variation in evolutionary perspective - inferences from decorative diversity and interassemblage distance in illinois woodland ceramic assemblages","american antiquity","10.2307/282074",4,1995,0.769209607563298
"tschauner_archaeological_1994","tschauner h","archaeological systematics and cultural-evolution - retrieving the honor of culture history","man","10.2307/2803511",4,1994,0.701491634453873
"prentiss_evolution_2015","prentiss am;goodale n;harris n","evolution of the slate tool industry at bridge river, british columbia","lithic technological systems and evolutionary theory","NA",4,2015,0.826345094321859
"stevens_what_2015","stevens ne","what steward got right: technology, work organization, and cultural evolution","lithic technological systems and evolutionary theory","NA",4,2015,0.825347660446058
"bettinger_macroevolutionary_2009","bettinger rl","macroevolutionary theory and archaeology: is there a big picture?","macroevolution in human prehistory: evolutionary theory and processual archaeology","10.1007/978-1-4419-0682-3\_11",4,2009,0.882498661098178
"lyman_evolutionary_2006","lyman rl;o'brien mj","evolutionary archaeology is unlikely to go extinct: response to gabora","world archaeology","10.1080/00438240600963460",4,2006,0.85341988176147
"eldredge_foreword_2006","eldredge n","foreword","mapping our ancestors","NA",4,2006,0.809437262766004
"silva-gago_visual_2022","silva-gago m;ioannidou f;fedato t;bruner e","visual attention and cognitive archaeology: an eye-tracking study of palaeolithic stone tools","perception","10.1177/03010066211069504",5,2022,0.574201046887503
"mika_north_2021","mika a;buchanan b;walker r;key b;bebber m;eren m","north american clovis point form and performance iii: an experimental assessment of knife cutting efficiency","lithic technology","10.1080/01977261.2021.2016257",5,2021,0.674756034998333
"hashemi_investigation_2021","hashemi sm;nasab hv;berillon m","an investigation of the flake-based lithic tool morphology using 3d geometric morphometrics: a case study from the mirak paleolithic site, iran","journal of archaeological science-reports","10.1016/j.jasrep.2021.102948",5,2021,0.520765401944021
"shoaee_paleolithic_2021","shoaee mj;nasab hv;petraglia md","the paleolithic of the iranian plateau: hominin occupation history and implications for human dispersals across southern asia","journal of anthropological archaeology","10.1016/j.jaa.2021.101292",5,2021,0.25943903854831
"rosenberg-yefet_acheulian_2021","rosenberg-yefet t;shemer m;barkai r","acheulian shortcuts: cumulative culture and the use of handaxes as cores for the production of predetermined blanks","journal of archaeological science-reports","10.1016/j.jasrep.2021.102822",5,2021,0.667853739081257
"bebber_role_2021","bebber mr","the role of functional efficiency in the decline of north america's copper culture (8000-3000 bp): an experimental, ecological, and evolutionary approach","journal of archaeological method and theory","10.1007/s10816-020-09497-0",5,2021,0.694336555906733
"premo_reconciling_2020","premo ls","reconciling and reassessing the accumulated copying error model's population-level predictions for continuous cultural traits","american anthropologist","10.1111/aman.13485",5,2020,0.776125252254799
"stade_theory_2020","stade cm","theory of mind as a proxy for palaeolithic language ability an alternative to the search for the earliest symbolic material culture","language dynamics and change","10.1163/22105832-20201000",5,2020,0.584849868772611
"manem_modeling_2020","manem s","modeling the evolution of ceramic traditions through a phylogenetic analysis of thechaines operatoires: the european bronze age as a case study","journal of archaeological method and theory","10.1007/s10816-019-09434-w",5,2020,0.844319182692665
"lycett_spatially_2020","lycett sj","spatially mediated cultural transmission and the distribution of horse blanket styles among post-contact and reservation-period tribes of western north america","archaeological and anthropological sciences","10.1007/s12520-019-00973-7",5,2020,0.698326837585653
"smith_discerning_2020","smith hl;kuzminsky sc;linderholm a","discerning dispersals along the pacific and interior corridors: contributions of geometric morphometrics to the peopling of the americas","paleoamerica","10.1080/20555563.2019.1696149",5,2020,0.545481988535102
"schmidt_birch_2019","schmidt p;blessing m;rageot m;iovita r;pfleging j;nickel kg;righetti l;tennie c","birch tar production does not prove neanderthal behavioral complexity","proceedings of the national academy of sciences of the united states of america","10.1073/pnas.1911137116",5,2019,0.403340032704414
"pargeter_understanding_2019","pargeter j;khreisheh n;stout d","understanding stone tool-making skill acquisition: experimental methods and evolutionary implications","journal of human evolution","10.1016/j.jhevol.2019.05.010",5,2019,0.678951950715909
"shilton_is_2019","shilton d","is language necessary for the social transmission of lithic technology?","journal of language evolution","10.1093/jole/lzz004",5,2019,0.381104489820929
"lycett_confirmation_2019","lycett sj","confirmation of the role of geographic isolation by distance in among-tribe variations in beadwork designs and manufacture on the high plains","archaeological and anthropological sciences","10.1007/s12520-018-0742-3",5,2019,0.617564858408779
"lycett_cultural_2019","lycett sj","cultural transmission in the post-contact plateau region and beyond: insights from funerary practices, fishing practices, clothing, and languages","journal of anthropological archaeology","10.1016/j.jaa.2019.04.005",5,2019,0.74989248270297
"obrien_more_2019","o'brien mj","more on clovis learning: individual-level processes aggregate to form population-level patterns","paleoamerica","10.1080/20555563.2019.1600126",5,2019,0.750174367297535
"hamilton_spatiotemporal_2019","hamilton mj;buchanan b;walker rs","spatiotemporal diversification of projectile point types in western north america over 13,000 years","journal of archaeological science-reports","10.1016/j.jasrep.2019.01.029",5,2019,0.814319820011931
"obrien_setting_2019","o'brien mj","setting the stage: the late pleistocene colonization of north america","quaternary","10.3390/quat2010001",5,2019,0.632663198688501
"schillinger_flow_2019","schillinger k;lycett sj","the flow of culture: assessing the role of rivers in the inter-community transmission of material traditions in the upper amazon","journal of archaeological method and theory","10.1007/s10816-018-9369-z",5,2019,0.583080241787522
"maloney_towards_2019","maloney tr","towards quantifying teaching and learning in prehistory using stone artifact reduction sequences","lithic technology","10.1080/01977261.2018.1564855",5,2019,0.693100488733308
"okumura_archaeology_2019","okumura m;araujo agm","archaeology, biology, and borrowing: a critical examination of geometric morphometrics in archaeology","journal of archaeological science","10.1016/j.jas.2017.09.015",5,2019,0.796329732856587
"drost_toy_2018","drost cj;vander linden m","toy story: homophily, transmission and the use of simple simulation models for assessing variability in the archaeological record","journal of archaeological method and theory","10.1007/s10816-018-9394-y",5,2018,0.70473491153338
"dorland_touch_2018","dorland sgh","the touch of a child: an analysis of fingernail impressions on late woodland pottery to identify childhood material interactions","journal of archaeological science-reports","10.1016/j.jasrep.2018.07.020",5,2018,0.68582531068344
"smith_origins_2018","smith hl;goebel t","origins and spread of fluted-point technology in the canadian ice-free corridor and eastern beringia","proceedings of the national academy of sciences of the united states of america","10.1073/pnas.1800312115",5,2018,0.668874997361418
"garvey_current_2018","garvey r","current and potential roles of archaeology in the development of cultural evolutionary theory","philosophical transactions of the royal society b-biological sciences","10.1098/rstb.2017.0057",5,2018,0.910228009835318
"wood_wound_2018","wood j;fitzhugh b","wound ballistics: the prey specific implications of penetrating trauma injuries from osseous, flaked stone, and composite inset microblade projectiles during the pleistocene/holocene transition, alaska usa","journal of archaeological science","10.1016/j.jas.2017.10.006",5,2018,0.600538012223357
"ting_indigenous_2018","ting c;hung ju;hofman cl;degryse p","indigenous technologies and the production of early colonial ceramics in dominican republic","journal of archaeological science-reports","10.1016/j.jasrep.2017.10.035",5,2018,0.455542452139696
"lycett_david_2018","lycett sj;shennan sj","david clarke's analytical archaeology at 50","world archaeology","10.1080/00438243.2018.1470561",5,2018,0.866397894960638
"riede_role_2018","riede f;johannsen nn;hogberg a;nowell a;lombard m","the role of play objects and object play in human cognitive evolution and innovation","evolutionary anthropology","10.1002/evan.21555",5,2018,0.62196231783872
"lycett_cultural_2017","lycett sj","cultural patterns within and outside of the post-contact great plains as revealed by parfleche characteristics: implications for areal arrangements in artifactual data","journal of anthropological archaeology","10.1016/j.jaa.2017.07.003",5,2017,0.601660252393401
"bebber_tempered_2017","bebber mr","tempered strength: a controlled experiment assessing opportunity costs of adding temper to clay","journal of archaeological science","10.1016/j.jas.2017.08.002",5,2017,0.670170506261955
"schillinger_differences_2017","schillinger k;mesoudi a;lycett sj","differences in manufacturing traditions and assemblage-level patterns: the origins of cultural differences in archaeological data","journal of archaeological method and theory","10.1007/s10816-016-9280-4",5,2017,0.782307960455861
"buchanan_environment-induced_2017","buchanan b;chao a;chiu ch;colwell rk;o'brien mj;werner a;eren mi","environment-induced changes in selective constraints on social learning during the peopling of the americas","scientific reports","10.1038/srep44431",5,2017,0.674118756730553
