mybibtex_key,Author(s),Title,Outlet,DOI,Cluster,Year of publication,size,closeness_centrality,degree_centrality
ross_frequency-dependent_2015,ross ct;joyas campino p;winterhalder b,frequency-dependent social transmission and the interethnic transfer of female genital modification in the african diaspora and indigenous populations of colombia,human nature-an interdisciplinary biosocial perspective,10.1007/s12110-015-9234-7,1,2015,43,0.4268838748434511,0.09290953545232274
wilf_routinized_2015,wilf e,routinized business innovation: an undertheorized engine of cultural evolution,american anthropologist,10.1111/aman.12336,3,2015,58,0.5848742748644798,0.4254278728606357
luncz_primate_2015,luncz lv;wittig rm;boesch c,primate archaeology reveals cultural transmission in wild chimpanzees (pan troglodytes verus),philosophical transactions of the royal society b-biological sciences,10.1098/rstb.2014.0348,4,2015,64,0.7391153932524075,0.24449877750611246
gallagher_transition_2015,gallagher em;shennan sj;thomas mg,"transition to farming more likely for small, conservative groups with property rights, but increased productivity is not essential",proceedings of the national academy of sciences of the united states of america,10.1073/pnas.1511870112,5,2015,9,0.7258754565005063,0.1295843520782396
lawson_no_2015,lawson dw;james s;ngadaya e;ngowi b;mfinanga sgm;mulder mb,no evidence that polygynous marriage is a harmful cultural practice in northern tanzania,proceedings of the national academy of sciences of the united states of america,10.1073/pnas.1507151112,1,2015,23,0.6068057874643339,0.0488997555012225
martinon-torres_prehistoric_2015,martinon-torres m;uribe-villegas ma,"the prehistoric individual, connoisseurship and archaeological science: the muisca goldwork of colombia",journal of archaeological science,10.1016/j.jas.2015.08.014,3,2015,12,0.5967634476074628,0.05378973105134474
schillinger_impact_2015,schillinger k;mesoudi a;lycett sj,the impact of imitative versus emulative learning mechanisms on artifactual variation: implications for the evolution of material culture,evolution and human behavior,10.1016/j.evolhumbehav.2015.04.003,3,2015,70,0.7094870972100255,0.7359413202933985
timpson_inferential_2015,timpson a;manning k;shennan s,inferential mistakes in population proxies: a response to torfing's ``neolithic population and summed probability distribution of c-14-dates'',journal of archaeological science,10.1016/j.jas.2015.08.018,2,2015,8,0.4403161695024727,0.1271393643031785
rorabaugh_modeling_2015,rorabaugh a,modeling pre-european contact coast salish seasonal social networks and their impacts on unbiased cultural transmission,jasss-the journal of artificial societies and social simulation,10.18564/jasss.2911,3,2015,107,0.7003772451655317,0.7775061124694377
byerly_coffin_2015,byerly rm;roberson jc;egeland cp,"the coffin bison kill (5ja7): bridging perspectives on the past at the door to north park, colorado",north american archaeologist,10.1177/0197693115572773,3,2015,1,0.25357819347696997,0
french_demography_2015,french jc,the demography of the upper palaeolithic hunter-gatherers of southwestern france: a multi-proxy approach using archaeological data,journal of anthropological archaeology,10.1016/j.jaa.2015.04.005,4,2015,3,0.8869775128714802,0.8361858190709046
sharifi_abrupt_2015,sharifi a;pourmand a;canuel e;peterson lc;aichner sj;daryaee t;djamali m;beni an;lahijani hak;swart pk,"abrupt climate variability since the last deglaciation based on a high-resolution, multi-proxy peat record from nw iran: the hand that rocked the cradle of civilization?",quaternary science reviews,10.1016/j.quascirev.2015.07.006,2,2015,98,0.7488924974425206,0.13691931540342298
ellis_ecology_2015,ellis ec,ecology in an anthropogenic biosphere,ecological monographs,10.1890/14-2274.1,1,2015,22,0.91642253405633,0.9779951100244498
scuderi_anthropology_2015,scuderi a,the anthropology of dario fo: an interdisciplinary approach,new theatre quarterly,10.1017/s0266464x15000433,NA,NA,NA,NA,NA
zhuang_neolithisation_2015,zhuang y,neolithisation in north china: landscape and geoarchaeological perspectives,environmental archaeology,10.1179/1749631414y.0000000047,2,2015,15,0.6147524095893624,0.11246943765281174
soriano_still_2015,soriano s;villa p;delagnes a;degano i;pollarolo l;lucejko jj;henshilwood c;wadley l,the still bay and howiesons poort at sibudu and blombos: understanding middle stone age technologies,plos one,10.1371/journal.pone.0131127,4,2015,73,0.7169836912524833,0.27383863080684595
acerbi_if_2015,acerbi a;mesoudi a,if we are all cultural darwinians what's the fuss about? clarifying recent disagreements in the field of cultural evolution,biology \& philosophy,10.1007/s10539-015-9490-2,1,2015,1,0.7442520779323503,0.7775061124694377
li_population_2015,li h;an c;fan w;dong w;zhao y;wang h,"population history and its relationship with climate change on the chinese loess plateau during the past 10,000years",holocene,10.1177/0959683615580200,2,2015,49,0.6025220143006472,0.2176039119804401
maccoun_balancing_2015,maccoun rj,balancing evidence and norms in cultural evolution,organizational behavior and human decision processes,10.1016/j.obhdp.2014.09.009,1,2015,3,0.5589487054396501,0.5354523227383863
conard_examining_2015,conard nj;will m,"examining the causes and consequences of short-term behavioral change during the middle stone age at sibudu, south africa",plos one,10.1371/journal.pone.0130001,4,2015,7,0.7922878967795925,0.8704156479217604
derrico_tephra_2015,d'errico f;banks we,tephra studies and the reconstruction of middle-to-upper paleolithic cultural trajectories,quaternary science reviews,10.1016/j.quascirev.2014.05.014,4,2015,3,0.7054800281130269,0.31295843520782396
araujo_vastness_2015,araujo agm,"on vastness and variability: cultural transmission, historicity, and the paleoindian record in eastern south america",anais da academia brasileira de ciencias,10.1590/0001-3765201520140219,3,2015,1,0.6842866075000084,0.5819070904645477
gautney_new_2015,gautney jr;holliday tw,new estimations of habitable land area and human population size at the last glacial maximum,journal of archaeological science,10.1016/j.jas.2015.03.028,2,2015,14,0.6526822377063254,0.6919315403422983
lycett_toward_2015,lycett sj;von cramon-taubadel n,toward a ``quantitative genetic'' approach to lithic variation,journal of archaeological method and theory,10.1007/s10816-013-9200-9,3,2015,280,0.8046263796994184,0.7995110024449877
morgan_is_2015,morgan c,is it intensification yet? current archaeological perspectives on the evolution of hunter-gatherer economies,journal of archaeological research,10.1007/s10814-014-9079-3,5,2015,1,0.8675408442284559,0.5525672371638142
munson_metaphors_2015,munson j,from metaphors to practice operationalizing network concepts for archaeological stratigraphy,journal of archaeological method and theory,10.1007/s10816-013-9181-8,3,2015,34,0.7215495726056209,0.18092909535452323
romanowska_so_2015,romanowska i,so you think you can model? a guide to building and evaluating archaeological simulation models of dispersals,human biology,10.13110/humanbiology.87.3.0169,3,2015,7,0.7745016221792483,0.35207823960880197
wren_does_2015,wren cd;costopoulos a,does environmental knowledge inhibit hominin dispersal?,human biology,10.13110/humanbiology.87.3.0205,4,2015,86,0.7678044979351528,0.6503667481662592
isaksson_novel_2015,isaksson s;funcke a;envall i;enquist m;lindenfors p,"a novel method to analyze social transmission in chronologically sequenced assemblages, implemented on cultural inheritance of the art of cooking",plos one,10.1371/journal.pone.0122092,4,2015,9,0.27788396649115016,0.014669926650366748
fort_demic_2015,fort j,demic and cultural diffusion propagated the neolithic transition across different regions of europe,journal of the royal society interface,10.1098/rsif.2015.0166,2,2015,4,0.512451932910024,0.11491442542787286
sear_evolutionary_2015,sear r,evolutionary contributions to the study of human fertility,population studies-a journal of demography,10.1080/00324728.2014.982905,1,2015,5,0.7045096653267832,0.5672371638141809
lipo_theoretically-sufficient_2015,lipo cp;madsen me;dunnell rc,a theoretically-sufficient and computationally-practical technique for deterministic frequency seriation,plos one,10.1371/journal.pone.0124942,3,2015,62,0.6605484892781763,0.41075794621026895
lycett_cultural_2015,lycett sj,"cultural evolutionary approaches to artifact variation over time and space: basis, progress, and prospects",journal of archaeological science,10.1016/j.jas.2015.01.004,3,2015,55,0.7578502505142675,0.8386308068459658
kozlowski_origin_2015,kozlowski jk,the origin of the gravettian,quaternary international,10.1016/j.quaint.2014.03.025,4,2015,62,0.42529588276197744,0.017114914425427872
eren_social_2015,eren mi;buchanan b;o'brien mj,social learning and technological evolution during the clovis colonization of the new world,journal of human evolution,10.1016/j.jhevol.2015.01.002,3,2015,11,0.8015662474314428,0.7188264058679706
rappaport_matrix_2015,rappaport mb;corbally c,"matrix thinking: an adaptation at the foundation of human science, religion, and art",zygon,10.1111/zygo.12161,4,2015,74,0.6210573494747069,0.18337408312958436
shennan_isolation-by-distance_2015,shennan sj;crema er;kerig t,"isolation-by-distance, homophily, and ``core'' vs. ``package'' cultural evolution models in neolithic europe",evolution and human behavior,10.1016/j.evolhumbehav.2014.09.006,1,2015,37,0.6366197095969383,0.34474327628361856
rangan_food_2015,rangan h;alpers ea;denham t;kull ca;carney j,food traditions and landscape histories of the indian ocean world: theoretical and methodological reflections,environment and history,10.3197/096734015x14183179969863,1,2015,36,0.6457808299160048,0.07823960880195599
rorabaugh_timing_2015,rorabaugh an;fulkerson tj,"timing of the introduction of arrow technologies in the salish sea, northwest north america",lithic technology,10.1179/2051618514y.0000000009,3,2015,73,0.704817681108464,0.2713936430317848
stevenson_telling_2015,stevenson a,telling times: time and ritual in the realization of the early egyptian state,cambridge archaeological journal,10.1017/s0959774314000742,2,2015,8,0.7822811108958074,0.20537897310513448
gayo_timing_2015,gayo em;latorre c;santoro cm,timing of occupation and regional settlement patterns revealed by time-series analyses of an archaeological radiocarbon database for the south-central andes (16 degrees-25 degrees s),quaternary international,10.1016/j.quaint.2014.09.076,2,2015,30,0.6622578408703866,0.16136919315403422
gibson_applying_2015,gibson ma;lawson dw,applying evolutionary anthropology,evolutionary anthropology,10.1002/evan.21432,1,2015,22,0.7236640738137566,0.24205378973105135
haidle_nature_2015,haidle mn;bolus m;collard m;conard nj;garofoli d;lombard m;nowell a;tennie c;whiten a,the nature of culture: an eight-grade model for the evolution and expansion of cultural capacities in hominins and other animals,journal of anthropological sciences,10.4436/jass.93011,4,2015,26,0.793706922329796,0.5990220048899756
jipa_some_2015,jipa m,some ancient systems versus the alphabetic form of writing,discourse as a form of multiculturalism in literature and communication - history and cultural mentalities,NA,NA,NA,NA,NA,NA
de_la_torre_transition_2014,de la torre i;mora r,the transition to the acheulean in east africa: an assessment of paradigms and evidence from olduvai gorge (tanzania),journal of archaeological method and theory,10.1007/s10816-013-9176-5,4,2014,12,0.7853784426619936,0.18092909535452323
lam_everything_2014,lam w,everything old is new again? rethinking the transition to cast iron production in the central plains of china,journal of anthropological research,10.3998/jar.0521004.0070.402,3,2014,40,0.651242546927885,0.34474327628361856
popov_neolithization_2014,popov an;tabarev av;mikishin ya,"neolithization and ancient landscapes in southern primorye, russian far east",journal of world prehistory,10.1007/s10963-014-9073-1,NA,NA,NA,NA,NA
timpson_reconstructing_2014,timpson a;colledge s;crema e;edinborough k;kerig t;manning k;thomas mg;shennan s,reconstructing regional population fluctuations in the european neolithic using radiocarbon dates: a new case-study using an improved method,journal of archaeological science,10.1016/j.jas.2014.08.011,2,2014,55,0.42916142059075446,0.13202933985330073
warinner_direct_2014,warinner c;hendy j;speller c;cappellini r;trachsel c;arneborg j;lynnerup oe;swallow dm;fotakis a;christensen rj;olsen jv;liebert a;montalva n;fiddyment s;mackie m;canci a;bouwman a;ruehli f;gilbert mtp;collins mj,direct evidence of milk consumption from ancient human dental calculus,scientific reports,10.1038/srep07104,2,2014,74,0.3008344806787337,0.014669926650366748
hrotic_evolution_2014,hrotic s,the evolution and extinction of science fiction,public understanding of science,10.1177/0963662513478898,1,2014,48,0.5015554395429777,0.18337408312958436
oinonen_event_2014,oinonen m;pesonen p;alenius t;heyd v;holmqvist-saukkonen e;kivimaki s;nygren t;sundell t;onkamo p,event reconstruction through bayesian chronology: massive mid-holocene lake-burst triggered large-scale ecological and cultural change,holocene,10.1177/0959683614544049,2,2014,29,0.4704404748364198,0.17114914425427874
waymire_neuroscience_2014,waymire gb,neuroscience and ultimate causation in accounting research,accounting review,10.2308/accr-50881,1,2014,45,0.45521586988670965,0.08557457212713937
woodbridge_impact_2014,woodbridge j;fyfe rm;roberts n;downey s;edinborough k;shennan s,the impact of the neolithic agricultural transition in britain: a comparison of pollen-based land-cover and archaeological c-14 date-inferred population change,journal of archaeological science,10.1016/j.jas.2012.10.025,2,2014,38,0.4443763224112365,0.09290953545232274
martin_great_2014,martin lh,great expectations for ara norenzayan's big gods,religion,10.1080/0048721x.2014.937062,1,2014,4,0.3409048476870537,0.022004889975550123
crema_approximate_2014,crema er;edinborough k;kerig t;shennan sj,an approximate bayesian computation approach for inferring patterns of cultural evolutionary change,journal of archaeological science,10.1016/j.jas.2014.07.014,3,2014,5,0.7262411277527577,0.7628361858190709
manning_demographic_2014,manning k;timpson a,the demographic response to holocene climate change in the sahara,quaternary science reviews,10.1016/j.quascirev.2014.07.003,2,2014,13,0.5375223582574561,0.10757946210268948
schug_birth_2014,schug gr;goldman hm,"birth is but our death begun: a bioarchaeological assessment of skeletal emaciation in immature human skeletons in the context of environmental, social, and subsistence transition",american journal of physical anthropology,10.1002/ajpa.22536,2,2014,15,0.3894850160309605,0.05378973105134474
bentley_effects_2014,bentley ra;caiado ccs;ormerod p,effects of memory on spatial heterogeneity in neutrally transmitted culture,evolution and human behavior,10.1016/j.evolhumbehav.2014.02.001,3,2014,1,0.685306231311561,0.6943765281173594
mackay_coalescence_2014,mackay a;stewart ba;chase bm,coalescence and fragmentation in the late pleistocene archaeology of southernmost africa,journal of human evolution,10.1016/j.jhevol.2014.03.003,4,2014,13,0.8905465206135409,0.8386308068459658
barcelo_modeling_2014,barcelo ja;capuzzo g;bogdanovic i,modeling expansive phenomena in early complex societies: the transition from bronze iron age in prehistoric europe,journal of archaeological method and theory,10.1007/s10816-013-9195-2,2,2014,5,0.7069925648353326,0.6919315403422983
downey_all_2014,downey g,all forms of writing,mind \& language,10.1111/mila.12052,1,2014,18,0.39467067765664837,0.13202933985330073
lake_trends_2014,lake mw,trends in archaeological simulation,journal of archaeological method and theory,10.1007/s10816-013-9188-1,3,2014,6,0.8687076203759877,0.5745721271393643
sarjeant_mental_2014,sarjeant c,"mental templates and ceramic manufacture at neolithic an son, southern vietnam",cambridge archaeological journal,10.1017/s0959774314000468,3,2014,14,0.6401758656318313,0.5916870415647921
dean_human_2014,dean lg;vale gl;laland kn;flynn e;kendal rl,human cumulative culture: a comparative perspective,biological reviews,10.1111/brv.12053,4,2014,1,0.7011273097921318,0.7114914425427873
okumura_long-term_2014,okumura m;araujo agm,long-term cultural stability in hunter-gatherers: a case study using traditional and geometric morphometric analysis of lithic stemmed bifacial points from southern brazil,journal of archaeological science,10.1016/j.jas.2014.02.009,3,2014,39,0.7136238877265713,0.5207823960880196
crema_culture_2014,crema er;kerig t;shennan s,"culture, space, and metapopulation: a simulation-based study for evaluating signals of blending and branching",journal of archaeological science,10.1016/j.jas.2014.01.002,3,2014,1,0.6855463660782465,0.6821515892420538
iamoni_transitions_2014,iamoni m,"transitions in ceramics, a critical account and suggested approach: case-study through comparison of the eba-mba and mba-lba horizons at qatna",levant,10.1179/0075891413z.00000000028,3,2014,63,0.7980994375171049,0.39119804400978
power_economic_2014,power rc;rosen am;nadel d,the economic and ritual utilization of plants at the raqefet cave natufian site: the evidence from phytoliths,journal of anthropological archaeology,10.1016/j.jaa.2013.11.002,2,2014,1,0.61500435336589665,0.07579462102689487
ma_process_2014,ma m;dong g;chen f;meng x;wang z;elston r;li g,"process of paleofloods in guanting basin, qinghai province, china and possible relation to monsoon strength during the mid-holocene",quaternary international,10.1016/j.quaint.2012.05.031,2,2014,3,0.517179568718122,0.1295843520782396
muthukrishna_sociality_2014,muthukrishna m;shulman bw;vasilescu j,sociality influences cultural complexity,proceedings of the royal society b-biological sciences,10.1098/rspb.2013.2511,4,2014,1,0.6564532996451072,0.45965770171149145
abel_culture_2014,abel t,culture in cycles: considering h. t. odum's `information cycle',international journal of general systems,10.1080/03081079.2013.852188,1,2014,1,0.6243809703780983,0.3056234718826406
jolie_technology_2014,jolie ea,"technology, learning, and innovation in textile arts: integrating archaeological and ethnographic perspectives",north american archaeologist,10.2190/na.35.4.c,3,2014,22,0.7356188206550107,0.7506112469437652
vaesen_modelling_2014,vaesen k;houkes w,modelling the truth of scientific beliefs with cultural evolutionary theory,synthese,10.1007/s11229-013-0257-5,4,2014,32,0.5447330059094427,0.6259168704156479
dong_spatiotemporal_2013,dong g;wang l;cui y;elston r;chen f,"the spatiotemporal pattern of the majiayao cultural evolution and its relation to climate change and variety of subsistence strategy during late neolithic period in gansu and qinghai provinces, northwest china",quaternary international,10.1016/j.quaint.2013.07.038,2,2013,2,0.609662220619264,0.17603911980440098
cochrane_plainware_2013,cochrane ee;rieth tm;dickinson wr,"plainware ceramics from samoa: insights into ceramic chronology, cultural transmission, and selection among colonizing populations",journal of anthropological archaeology,10.1016/j.jaa.2013.08.005,3,2013,4,0.755237227409977,0.5403422982885085
collard_population_2013,collard m;buchanan b;o''brien mj,population size as an explanation for patterns in the paleolithic archaeological record more caution is needed,current anthropology,10.1086/673881,4,2013,19,0.6313155275893834,0.4841075794621027
kline_teaching_2013,kline ma;boyd r;henrich j,teaching and the life history of cultural transmission in fijian villages,human nature-an interdisciplinary biosocial perspective,10.1007/s12110-013-9180-1,1,2013,3,0.6390197150934649,0.5990220048899756
kuhn_alternative_2013,kuhn sl;hovers e,alternative pathways to complexity: evolutionary trajectories in the middle paleolithic and middle stone age an introduction to supplement 8,current anthropology,10.1086/673501,4,2013,9,0.7652902485192297,0.31295843520782396
mace_cooperation_2013,mace r,cooperation and conflict between women in the family,evolutionary anthropology,10.1002/evan.21374,1,2013,4,0.5528692116334465,0.12224938875305623
nettle_human_2013,nettle d;gibson ma;lawson dw;sear r,human behavioral ecology: current research and future prospects,behavioral ecology,10.1093/beheco/ars222,1,2013,14,0.8619903840734588,0.39364303178484106
parkington_introduction_2013,parkington je;rigaud jp;poggenpoel c;porraz g;texier pj,"introduction to the project and excavation of diepkloof rock shelter (western cape, south africa): a view on the middle stone age",journal of archaeological science,10.1016/j.jas.2013.02.017,4,2013,30,0.5625509935056239,0.14180929095354522
zvelebil_human_2013,zvelebil m;weber aw,human bioarchaeology: group identity and individual life histories - introduction,journal of anthropological archaeology,10.1016/j.jaa.2012.01.003,3,2013,144,0.6572632360112429,0.7872860635696821
juan_muscio_archaeological_2013,juan muscio h,"the archaeological record of the gorge of urcuro, puna of salta, argentina, in an evolutionary perspective",intersecciones en antropologia,NA,2,2013,15,0.5826408673660826,0.05378973105134474
mullins_role_2013,mullins da;whitehouse h;atkinson qd,the role of writing and recordkeeping in the cultural evolution of human cooperation,journal of economic behavior \& organization,10.1016/j.jebo.2012.12.017,1,2013,25,0.7115716847878393,0.31295843520782396
newman_ballistically_2013,newman k;moore mw,ballistically anomalous stone projectile points in australia,journal of archaeological science,10.1016/j.jas.2013.01.023,4,2013,6,0.7296482171658641,0.6356968215158925
white_abstract_2013,white a,an abstract model showing that the spatial structure of social networks affects the outcomes of cultural transmission processes,jasss-the journal of artificial societies and social simulation,10.18564/jasss.2219,3,2013,12,0.6192153977724278,0.44987775061124696
lind_dating_2013,lind j;lindenfors p;ghirlanda s;liden k;enquist m,dating human cultural capacity using phylogenetic principles,scientific reports,10.1038/srep01785,4,2013,1,0.7290446147225904,0.4254278728606357
gong_multidisciplinary_2013,gong t;shuai l;wu y,multidisciplinary approaches in evolutionary linguistics,language sciences,10.1016/j.langsci.2012.09.002,4,2013,4,0.6723121105456005,0.07579462102689487
jordan_evolutionary_2013,jordan fm;huber br,evolutionary approaches to cross-cultural anthropology,cross-cultural research,10.1177/1069397112471800,1,2013,23,0.6392109386694936,0.21026894865525672
laor_evolution_2013,laor y;jablonka e,the evolution and development of culture,history and theory,10.1111/hith.10669,1,2013,40,0.472164106756106,0.4889975550122249
mcnabb_pole_2013,mcnabb j,pole to pole. archaeology and adaptation in the middle pleistocene at opposite ends of the acheulean world,oxford journal of archaeology,10.1111/ojoa.12006,4,2013,15,0.7394840734510068,0.16625916870415647
cochrane_another_2013,cochrane gwg;doelman t;wadley l,another dating revolution for prehistoric archaeology?,journal of archaeological method and theory,10.1007/s10816-011-9125-0,4,2013,1,0.7871409760852622,0.684596577017115
qu_chinese_2013,qu t;bar-yosef o;wang y;wu x,"the chinese upper paleolithic: geography, chronology, and techno-typology",journal of archaeological research,10.1007/s10814-012-9059-4,4,2013,9,0.8919228226753797,0.33007334963325186
bar-yosef_following_2013,bar-yosef o;belfer-cohen a,following pleistocene road signs of human dispersals across eurasia,quaternary international,10.1016/j.quaint.2011.07.043,4,2013,5,0.884304141189623,0.4889975550122249
moore_simple_2013,moore mw,simple stone flaking in australasia: patterns and implications,quaternary international,10.1016/j.quaint.2011.09.030,4,2013,7,0.783404247843799,0.7995110024449877
testart_reconstructing_2013,testart a,reconstructing social and cultural evolution the case of dowry in the indo-european area,current anthropology,10.1086/668679,5,2013,221,0.6927253401958251,0.09290953545232274
anderson_high-resolution_2013,anderson sl;freeburg ak,"a high-resolution chronology for the cape krusenstern site complex, northwest alaska",arctic anthropology,10.3368/aa.50.1.49,2,2013,1,0.41695970409393895,0.05134474327628362
oslisly_west_2013,oslisly r;bentaleb i;favier c;fontugne m;gillet jf;morin-rivat j,west central african peoples: survey of radiocarbon dates over the past 5000 years,radiocarbon,10.1017/s003382220004830x,NA,NA,NA,NA,NA
smith_agency_2013,smith ea,agency and adaptation: new directions in evolutionary anthropology,"annual review of anthropology, vol 42",10.1146/annurev-anthro-092412-155447,1,2013,13,0.8900035670576425,0.6185819070904646
conard_what_2012,conard nj;porraz g;wadley l,what is in a name? characterising the `post-howieson's poort' at sibudu,south african archaeological bulletin,NA,4,2012,10,0.6875154892466906,0.18581907090464547
salvatori_disclosing_2012,salvatori s,disclosing archaeological complexity of the khartoum mesolithic: new data at the site and regional level,african archaeological review,10.1007/s10437-012-9119-7,3,2012,71,0.7289736497990872,0.58679706601467
fort_synthesis_2012,fort j,synthesis between demic and cultural diffusion in the neolithic transition in europe,proceedings of the national academy of sciences of the united states of america,10.1073/pnas.1200662109,2,2012,1,0.5986067282720802,0.34963325183374083
ducasse_what_2012,ducasse s,"what is left of the badegoulian ``interlude''? new data on cultural evolution in southern france between 23,500 and 20,500 cal. bp",quaternary international,10.1016/j.quaint.2012.05.018,2,2012,6,0.6764338864266549,0.1466992665036675
